{
  "schema": "ipcraft.patch.v1",
  "transactionId": "value",
  "patchId": "value",
  "source": {
    "kind": "undo-redo",
    "identity": "ipcraft.host",
    "version": "1"
  },
  "causality": {
    "sessionRevision": 0
  },
  "preconditions": [],
  "operations": [
    {
      "op": "updateEntity",
      "entityKind": "project",
      "id": "project.mesh",
      "set": {
        "name": "Restored"
      },
      "unset": []
    }
  ]
}
