{
  "schema": "ipcraft.patch.v1",
  "transactionId": "value",
  "patchId": "value",
  "source": {
    "kind": "user-command",
    "identity": "ipcraft.host",
    "version": "1"
  },
  "causality": {
    "sessionRevision": 0
  },
  "preconditions": [],
  "operations": [
    {
      "op": "createEntity",
      "entityKind": "package-entity",
      "localRef": "application:000010",
      "value": {
        "typeKey": "vendor.user-entity",
        "data": {},
        "extensions": []
      }
    }
  ]
}
