{
  "schema": "ipcraft.patch.v1",
  "transactionId": "value",
  "patchId": "value",
  "source": {
    "kind": "user-command",
    "identity": "ipcraft.host",
    "version": "1"
  },
  "causality": {
    "sessionRevision": 0
  },
  "preconditions": [],
  "operations": [
    {
      "op": "createRelation",
      "relationKind": "domain-membership",
      "localRef": "application:000001",
      "value": {
        "domainRef": {
          "id": "domain.default"
        },
        "routerRef": {
          "id": "router.0.0"
        }
      }
    }
  ]
}
