{
  "schema": "ipcraft.patch.v1",
  "transactionId": "value",
  "patchId": "value",
  "source": {
    "kind": "user-command",
    "identity": "ipcraft.host",
    "version": "1"
  },
  "causality": {
    "sessionRevision": 0
  },
  "preconditions": [],
  "operations": [
    {
      "op": "updateRelation",
      "relationKind": "domain-membership",
      "id": "membership.0",
      "set": {
        "routerRef": {
          "id": "router.0.1"
        }
      },
      "unset": []
    }
  ]
}
