{
  "schema": "ipcraft.patch.v1",
  "transactionId": "value",
  "patchId": "value",
  "source": {
    "kind": "user-command",
    "identity": "ipcraft.host",
    "version": "1"
  },
  "causality": {
    "sessionRevision": 0
  },
  "preconditions": [],
  "operations": [
    {
      "op": "createEntity",
      "entityKind": "interface",
      "localRef": "application:000001",
      "value": {
        "ownerComponentRef": {
          "id": "component.noc"
        },
        "templateKey": "axi-boundary",
        "name": "AXI Boundary",
        "contract": {
          "lockId": "dep.contract.axi5",
          "role": "initiator"
        },
        "capabilities": {},
        "contractConfig": {},
        "nocConfig": {},
        "extensions": []
      }
    }
  ]
}
