{
  "schema": "ipcraft.patch.v1",
  "transactionId": "value",
  "patchId": "value",
  "source": {
    "kind": "user-command",
    "identity": "ipcraft.host",
    "version": "1"
  },
  "causality": {
    "sessionRevision": 0
  },
  "preconditions": [],
  "operations": [
    {
      "op": "createRelation",
      "relationKind": "package-relation",
      "localRef": "application:000011",
      "value": {
        "typeKey": "vendor.user-relation",
        "sources": [],
        "targets": [],
        "data": {},
        "extensions": []
      }
    }
  ]
}
